{
  "$schema": "../../schemas/skill-interface-1.3.schema.json",
  "schema_version": "1.3",
  "id": "guru-verify-extension-installation",
  "name": "guru-verify-extension-installation",
  "description": "Verify extension installation through AI-owned applicability, profile selection, adequacy review, one private gate, and four typed exits.",
  "state": "active",
  "judgment_mode": "semantic",
  "modes": {
    "workflow": {
      "routing": "global_workflow",
      "entry_precondition_ids": ["runtime_dependency", "public_input", "repository_identity", "remote_identity", "extension_surface", "ownership_inventory", "persistence_boundary", "invocation_freshness"]
    },
    "standalone": {
      "routing": "direct_discovery",
      "entry_precondition_ids": ["runtime_dependency", "public_input", "repository_identity", "remote_identity", "extension_surface", "ownership_inventory", "persistence_boundary", "invocation_freshness"]
    }
  },
  "entry_preconditions": [
    {"id": "runtime_dependency", "evidence": "installed extension, dispatcher, active package, schemas and verification commands", "binding": "complete compatible Guru Team preset", "freshness": "validated before every command"},
    {"id": "public_input", "evidence": "one closed workflow or standalone profile", "binding": "mode, target, repository and caller intent", "freshness": "validated at invocation"},
    {"id": "repository_identity", "evidence": "current Git root, task mapping when present, target repository identity and credentials-safe canonical GitHub extension source locator", "binding": "separate public target and installed-manifest source identities", "freshness": "rebuilt before execute, record and check"},
    {"id": "remote_identity", "evidence": "target remote/ref plus source direct and peeled ref facts, isolated target/source checkouts and both HEAD^{commit} values", "binding": "target reviewed content and manifest-selected extension source commit", "freshness": "both identities are resolved and checkout-verified for the current invocation"},
    {"id": "extension_surface", "evidence": "reviewed diff, marketplace, preset, workflow, schema, runtime, platform and public docs facts", "binding": "AI applicability and profile coverage", "freshness": "reread before AI Gate"},
    {"id": "ownership_inventory", "evidence": "current Guru-owned rules and managed path claims", "binding": "extension source checkout only", "freshness": "validated from the manifest-selected source commit"},
    {"id": "persistence_boundary", "evidence": "task-bearing or session-only input branch", "binding": "one task-local artifact or no repository artifact", "freshness": "checked before and after invocation"},
    {"id": "invocation_freshness", "evidence": "plan/ref/HEAD, prior verification identity, semantic Gate and actual exit", "binding": "one complete current owner round", "freshness": "checker rejects drift, ambiguity and superseded evidence"}
  ],
  "runtime_dependency": {
    "extension_id": "guru-team",
    "api_version": "1.0",
    "manifest_path": ".trellis/guru-team/extension.json",
    "dispatcher": "run-skill-command",
    "distribution": "guru-team-preset",
    "package_portability": "not-self-contained"
  },
  "ordered_stages": ["forward_behavior", "ai_review_gate", "conditional_human_confirmation", "recorder_validator", "typed_exit"],
  "artifacts": [
    {"id": "workflow_input", "path": "examples/public-verification-required-input.json"},
    {"id": "workflow_input_authoring", "path": "examples/public-verification-required-authoring.json"},
    {"id": "standalone_input", "path": "examples/public-standalone-verification-input.json"},
    {"id": "execution_facts", "path": "examples/execution-facts.json"},
    {"id": "semantic_review_input", "path": "examples/semantic-review-input.json"},
    {"id": "legacy_private_evidence", "path": "examples/marketplace-verification.json"},
    {"id": "verification_result", "path": "examples/verification-result.json"},
    {"id": "verified_output", "path": "examples/public-verified-output.json"},
    {"id": "not_required_output", "path": "examples/public-not-required-output.json"},
    {"id": "return_to_task_work_output", "path": "examples/public-return-to-task-work-output.json"},
    {"id": "blocked_output", "path": "examples/public-blocked-output.json"},
    {"id": "public_invocation_error", "path": "examples/public-invocation-error.json"}
  ],
  "schemas": [
    {"id": "legacy_public_input_verification_required_2_0", "path": "schemas/public-verification-required-input.schema.json"},
    {"id": "public_input_verification_required", "path": "schemas/public-verification-required-input-3.0.schema.json"},
    {"id": "public_input_standalone_verification", "path": "schemas/public-standalone-verification-input.schema.json"},
    {"id": "legacy_public_input_aggregate_2_0", "path": "schemas/public-input.schema.json"},
    {"id": "public_input_aggregate", "path": "schemas/public-input-3.0.schema.json"},
    {"id": "legacy_public_verified_output_2_0", "path": "schemas/public-verified-output.schema.json"},
    {"id": "public_verified_output", "path": "schemas/public-verified-output-3.0.schema.json"},
    {"id": "public_not_required_output", "path": "schemas/public-not-required-output.schema.json"},
    {"id": "public_return_to_task_work_output", "path": "schemas/public-return-to-task-work-output.schema.json"},
    {"id": "public_blocked_output", "path": "schemas/public-blocked-output.schema.json"},
    {"id": "public_invocation_error", "path": "schemas/public-invocation-error.schema.json"},
    {"id": "execution_facts", "path": "schemas/execution-facts.schema.json"},
    {"id": "semantic_review_input", "path": "schemas/semantic-review-input.schema.json"},
    {"id": "legacy_private_marketplace_verification", "path": "schemas/marketplace-verification.schema.json"},
    {"id": "verification_result", "path": "schemas/verification-result.schema.json"}
  ],
  "validators": [
    {"id": "verification_executor", "command": "scripts/execute-extension-verification.sh", "runtime_command": "execute-extension-verification", "objective_scope": "Resolve and isolate target and extension source checkouts, bind target reviewed content to the target commit, select source provenance from the installed manifest or the taskless absent-manifest fallback, then execute the source-owned clean-install catalog and inventory"},
    {"id": "verification_recorder", "command": "scripts/record-extension-verification.sh", "runtime_command": "record-extension-verification", "objective_scope": "Record already completed AI applicability, profile, adequacy, findings and route with rebuilt machine facts"},
    {"id": "verification_checker", "command": "scripts/check-extension-verification.sh", "runtime_command": "check-extension-verification", "objective_scope": "Validate the one private evidence schema, identity, freshness, redaction, persistence and consumer without semantic judgment"},
    {"id": "public_invocation", "command": "scripts/invoke.sh", "runtime_command": "invoke-extension-verification", "objective_scope": "Validate public input, rerun the owner checker, select the actual exit schema branch and emit one minimal DTO"}
  ],
  "external_exits": [
    {"id": "verified", "evidence": "AI adequacy passed for every affected extension surface, every selected deterministic capability passed with command and installed asset evidence, and the expected installed inventory is complete and digest-matched", "consumer": {"kind": "skill", "id": "guru-finalize-task"}},
    {"id": "not_required", "evidence": "AI applicability review found no installable extension surface and no execution profile was fabricated", "consumer": {"kind": "skill", "id": "guru-finalize-task"}},
    {"id": "return_to_task_work", "evidence": "a task-bearing invocation has one or more open task-work findings", "consumer": {"kind": "workflow", "id": "guru-extension-verification-work-router"}},
    {"id": "blocked", "evidence": "remote, auth, network, taskless installation failure or another external dependency prevents completion", "consumer": {"kind": "stop", "id": "extension-installation-verification-blocked"}}
  ],
  "reentry": {
    "identity": "profile, mode, task or session boundary, plan, target repo/ref/HEAD/reviewed content, extension source repo/ref/direct object/selected commit/checkout HEAD, semantic Gate, actual exit and prior verification identity",
    "freshness": "same-identity transient retry reruns the complete Skill; target plan/ref/HEAD/content or installed-manifest/source ref/commit drift supersedes prior evidence",
    "stale_behavior": "fail_closed"
  },
  "tests": ["tests/test_contract.py"],
  "platform_destinations": ["shared", "codex", "cursor", "claude"],
  "public_contracts": {
    "input": {
      "kind": "structured_json",
      "aggregate_schema": {"schema_id": "guru-extension-verify-installation-input-aggregate-3.0", "path": "schemas/public-input-3.0.schema.json"},
      "profiles": [
        {
          "id": "verification_required",
          "schema": {"schema_id": "guru-extension-verify-installation-input-verification-required-3.0", "path": "schemas/public-verification-required-input-3.0.schema.json"},
          "example": {"id": "verification_required_input", "path": "examples/public-verification-required-input.json"},
          "discriminator": {"field": "profile", "value": "verification_required"}
        },
        {
          "id": "standalone_verification",
          "schema": {"schema_id": "guru-extension-verify-installation-input-standalone-verification-1.0", "path": "schemas/public-standalone-verification-input.schema.json"},
          "example": {"id": "standalone_verification_input", "path": "examples/public-standalone-verification-input.json"},
          "discriminator": {"field": "profile", "value": "standalone_verification"}
        }
      ]
    },
    "invocation": {
      "command_id": "run-skill-command",